{
  "project_id": "SAV_DEP_2026_01",
  "legal_status": "APPROVED_WITH_RESERVATIONS",
  "overall_risk_score": "MEDIUM",
  "compliance_audit": [
    {
      "regulation": "353-ФЗ / Правила ЦБ РФ о МГС",
      "status": "WARNING",
      "risk_level": "HIGH",
      "issue": "Приветственная ставка 18% отображается крупным шрифтом без равнозначного раскрытия МГС 10%",
      "judicial_precedent": "Определение ВС РФ № 305-ЭС24-XXXX",
      "required_mitigation": "Добавить блок МГС шрифтом того же размера в карточку продукта ДБО до клика 'Открыть счет'."
    }
  ],
  "contract_disclaimers_required": [
    "Формулировка согласия на обработку ПДн по 152-ФЗ с отдельным чекбоксом.",
    "Дисклеймер о рисках изменения ставки по вкладу до востребования."
  ]
}
